{
  "id": "psi_1_draconis_a",
  "name": "Psi 1 Draconis A",
  "rank": 2,
  "ra": 265.48359320893996,
  "dec": 72.14886878277,
  "dist": 22.8363,
  "otype": "SB*",
  "spect": "F5IV-V",
  "cat": 11,
  "proper": "Dziban",
  "by": "psi01",
  "by_greek": "ψ¹",
  "by_con": "Dra",
  "by_comp": "A",
  "fl": 31,
  "fl_con": "Dra",
  "fl_comp": "A"
}