{
  "id": "eta_canis_minoris_b",
  "name": "Eta Canis Minoris B",
  "rank": 4,
  "ra": 112.00920804598,
  "dec": 6.94302354986,
  "dist": 97.502,
  "otype": "*",
  "spect": "",
  "cat": 0,
  "by": "eta",
  "by_greek": "η",
  "by_con": "CMi",
  "by_comp": "B",
  "fl": 5,
  "fl_con": "CMi",
  "fl_comp": "B"
}
