{
  "id": "epsilon_canis_majoris_b",
  "name": "Epsilon Canis Majoris B",
  "rank": 4,
  "ra": 104.65722781236208,
  "dec": -28.974127640268343,
  "dist": 131.304,
  "otype": "*",
  "spect": "",
  "cat": 0,
  "by": "eps",
  "by_greek": "ε",
  "by_con": "CMa",
  "by_comp": "B",
  "fl": 21,
  "fl_con": "CMa",
  "fl_comp": "B"
}